13287,WOS:000985645900001,WOS,WOS.SSCI,Article,NA,NA,Article,English,51,NA,2,1,0,0,1,0,NA,"EMOTIONS,CHILDREN,HEALTH,ANGER,LIFE",Journal,141,61 (7): 1119-1129 SEP 1 2024,NA,NA,"Psychology, Clinical","Social Sciences, Interdisciplinary","Psychology,Social Sciences - Other Topics",Social Sciences,NA,"People with pedophilia (PWP) can deal with their sexual desires by relieving sexual arousal without sexually exploiting children. Study 1 investigated whether public reactions toward nonoffending pedophilic men are affected by their strategies to relieve sexual arousal (nonsexual pictures vs. child sex dolls) or to reduce their sex drive via testosterone lowering medication in legally nonproblematic ways. A sample of German-speaking participants (N = 143) read three vignettes describing PWP using either of these strategies. Participants' (59.4% females) mean age was 39.7 (SD = 15.6). Although no significant difference was detected between the nonsexual pictures and sex dolls conditions on cognitive (except for dangerousness), affective, and behavioral levels, both consistently elicited more stigmatizing reactions than the testosterone-lowering medication condition. To investigate if this effect was driven by disapproving any relief of sexual arousal or the use of actual child stimuli in particular, Study 2 (N = 151) added two conditions with PWP using adult child-like stimuli to relieve sexual arousal: adult-as-schoolgirl porn and adult partner with childlike appearance. Here, Participants' (57.6% females) mean age was 28.0 (SD = 13.3). Results indicate that stigmatization was driven by disapproving the use of child stimuli rather than the relief of sexual arousal in general. Individuals with a sexual interest in children face strong stigmatizing reactions, which are only alleviated when they are described as undergoing treatment lowering sex drive or - to a lesser extent - being able to mate with an adult partner or using porn with adult actors posing as schoolgirls.",SEP 1 2024,61,2024,2023-05-01,SEP 1,Journal,N,0022-4499,1559-8519,10.1080/00224499.2023.2198512,NA,MEDLINE:37163734,NA,NA,NA,JOURNAL OF SEX RESEARCH,Public Stigmatizing Reactions Toward Nonoffending Pedophilic Individuals Seeking to Relieve Sexual Arousal,J SEX RES,J. Sex Res.,J SEX RES,J SEX RES,1,publisher,"ROUTLEDGE JOURNALS, TAYLOR & FRANCIS LTD",1,"ROUTLEDGE JOURNALS, TAYLOR & FRANCIS LTD"
2346,WOS:001340803800001,WOS,WOS.SSCI,Article,NA,NA,Article,English,39,NA,1,1,0,0,0,0,NA,NA,Journal,120,50 (8): 988-1013 NOV 16 2024,NA,NA,"Psychology, Clinical",Family Studies,"Psychology,Family Studies",Social Sciences,NA,"PurposeThis review aimed to synthesize existing research on the prevalence of Child Sexual Exploitation and Abuse (CSEA) in schools, while also identifying key moderators that influence these rates.MethodsA comprehensive database search from 2012 to 2022 was conducted. Subgroup analyses and meta-regression were performed to examine the impact of various moderators on prevalence rates.Results70 studies with sample sizes ranging from 381 to 4,511 were included. The global prevalence of CSEA in schools was found to be 1.6%. Key moderators included the study's regional origin, the income level of the country, and the type of CSEA, with no significant variations noted based on gender, sample source/participant age, response rate, time period, data collection year, and publication year.DiscussionHighlighting the need for ongoing vigilance in CSEA prevention within schools, the study suggested targeted interventions based on identified moderating variables.",NOV 16 2024,50,2024,2024-10-17,NOV 16,Journal,N,0092-623X,1521-0715,10.1080/0092623X.2024.2418541,NA,MEDLINE:39445899,NA,NA,NA,JOURNAL OF SEX & MARITAL THERAPY,The Global Prevalence of Child Sexual Exploitation and Abuse in Schools between 2012 and 2022: A Systematic Review and Meta-Analysis,J SEX MARITAL THER,J. Sex Marital Ther.,J SEX MAR T,J SEX MAR THER,1,publisher,"ROUTLEDGE JOURNALS, TAYLOR & FRANCIS LTD",1,"ROUTLEDGE JOURNALS, TAYLOR & FRANCIS LTD"
2450,WOS:001337058300001,WOS,WOS.SSCI,Article,NA,NA,Article,English,62,NA,NA,NA,NA,NA,NA,NA,"Psychological flexibility,Students,EEMM,Network,Burnout,Mixed methods","COMMITMENT TRAINING ACT,PSYCHOLOGICAL FLEXIBILITY,SCHOOL BURNOUT,ACCEPTANCE,ENGAGEMENT,THERAPY,MINDFULNESS,PERFORMANCE,STRESS,HEALTH",Journal,10,34: - OCT 2024,NA,NA,"Psychology, Clinical",NA,Psychology,Social Sciences,NA,"Previous research in higher education has shown that Acceptance and Commitment Therapy (ACT)-based interventions have beneficial effects on students' well-being. However, not much is known about the range of behaviour changes behind these outcomes. In this mixed methods study, we explored the variety of the changes ACT-based course participating university students (N =101) describe in their reflective learning reports. We did so by applying the Extended Evolutionary Meta Model (EEMM) in abductive content analysis, and by applying network visualisation of the various study burnout risk change groups. The results showed that the largest proportion of students described changes in the EEMM dimension of overt behaviour (75%), especially time and effort management. Vitality, and decreased distress were the most described outcomes related to behaviour changes. Study burnout risk decreased significantly at the course level. When observing the interrelations of behaviour changes in the networks of burnout risk change groups, alongside time and effort management, attentional and affective dimensions representing present moment awareness and acceptance were central changes in the group that had the greatest reduction in burnout risk. These findings contribute to the need to map out the variety of beneficial mechanisms and serve further idiographic research about changes during study-integrated ACT-based interventions.",OCT 2024,34,2024,2024-10-16,OCT,Journal,N,2212-1447,2212-1455,10.1016/j.jcbs.2024.100845,NA,NA,NA,NA,NA,JOURNAL OF CONTEXTUAL BEHAVIORAL SCIENCE,Changes in university students' behaviour and study burnout risk during ACT-based online course intervention: A mixed methods study,J CONTEXT BEHAV SCI,J. Contextual Behav. Sci.,J CON BE SC,J CONTEXTUAL BEHAV SCI,1,publisher,ELSEVIER,1,ELSEVIER
91,WOS:001203271000001,WOS,"WOS.SCI,WOS.SSCI",Article,NA,NA,Article,English,61,NA,1,0,0,0,1,0,"major depressive disorder,depressive symptoms,cognitive impairment","LATE-LIFE DEPRESSION,NEUROPSYCHIATRIC SYMPTOMS,AMYLOID BURDEN,TRAJECTORIES,IMPAIRMENT,DEMENTIA,ASSOCIATION,ASPIRIN,RISK,FORM",Journal,85,36 (11): 1039-1050 Sp. Iss. SI NOV 2024,Life Sciences & Biomedicine,NA,"Psychology, Clinical",Geriatrics & Gerontology,"Psychology,Geriatrics & Gerontology,Psychiatry",Social Sciences,Science & Technology,"Objectives: Few studies have examined the impact of late-life depression trajectories on specific domains of cognitive function. This study aims to delineate how different depressive symptom trajectories specifically affect cognitive function in older adults.Design: Prospective longitudinal cohort studySetting: Australia and the United States of AmericaParticipants: In total, 11,035 community-dwelling older adults with a mean age of 75 yearsMeasurements: Depressive trajectories were modelled from depressive symptoms according to annual Centre for Epidemiological Studies Depression Scale 10 (CES-D-10) surveys. Four trajectories of depressive symptoms were identified: low (""nondepressed""), consistently mild (""subthreshold depression""), consistently moderate (""persistent depression""), and initially low but increasing (""emerging depression""). Global cognition (Modified Mini-Mental State Examination [3MS]), verbal fluency (Controlled Oral Word Association Test [COWAT]), processing speed (Symbol Digit Modalities Test [SDMT]), episodic memory (Hopkins Verbal Learning Test - Revised [HVLT-R]), and a composite z-score were assessed over a subsequent median 2 years.Results: Subthreshold depression predicted impaired performance on the SDMT (Cohen's d -0.04) and composite score (-0.03); emerging depression predicted impaired performance on the SDMT (-0.13), HVLT-R (-0.09), 3 MS (-0.08) and composite score (-0.09); and persistent depression predicted impaired performance on the SDMT (-0.08), 3 MS (-0.11), and composite score (-0.09).Conclusions: Depressive symptoms are associated with later impaired processing speed. These effects are small. Diverse depression trajectories have different impacts on cognitive function.",NOV 2024,36,2024,2024-04-16,NOV,Journal,N,1041-6102,1741-203X,10.1017/S1041610224000541,NA,NA,NA,NA,NA,INTERNATIONAL PSYCHOGERIATRICS,Depressive symptoms and cognitive decline in older adults,INT PSYCHOGERIATR,Int. Psychogeriatr.,INT PSYCHOG,INT PSYCHOGERIATR,1,publisher,ELSEVIER,1,ELSEVIER
6925,WOS:001230965000001,WOS,WOS.ESCI,Article,Early Access,NA,"Article,Early Access",English,89,NA,1,1,0,0,0,0,"Residential care for children,COVID-19 lockdown,Bronfenbrenner ecological model,managers,external stakeholders,community engagement,meso-system,exo-system","CHILDRENS HOMES,YOUTH,EXPERIENCES,LEADERSHIP,OUTCOMES,SUPPORT",Journal,26,: - MAY 27 2024,NA,NA,"Psychology, Clinical",NA,Psychology,Social Sciences,NA,"Drawing from an Italian study conducted during the COVID-19 lockdown, in this article we focus on the perspectives of Residential Care for Children (RCC) managers. Our aims are: to examine how they perceive RCC interactions with external stakeholders during lockdown - specifically within Bronfenbrenner's ecological framework, encompassing meso- and exo-systems -, and to identify managers' traits affecting communication with the abovementioned systems. The study involved 152 RCC managers on duty during the lockdown, utilizing the EWF Questionnaire - an anonymous, self-administered survey developed ad hoc for this investigation. The analysis employed descriptive statistics and Chi-square analysis. Results indicate that during the lockdown managers had good communication with RCC meso-system. In terms of professional relationships, RCC managers reported a closer affinity with social workers. Managers' age, tenure in the role and field experience had an impact on the perception of communication within meso- and exo-systems. The number of units managed and their education degree did not show statistically significant impact. In the final sections, we discuss implications for RCC, interprofessional collaboration, and strategies for enhancing intersystem communication.
RCC managers' age, field experience and tenure in the role must be considered, as they influence specific intersystem communication.RCC managers require specific training and organizational support to communicate effectively with meso- and exo-systems.Policymakers should fund interprofessional training programs to enhance relationships between RCC internal and external stakeholders.",NA,NA,2024,2024-05-27,MAY 27,Journal,N,0886-571X,1541-0358,10.1080/0886571X.2024.2355934,NA,NA,NA,NA,NA,RESIDENTIAL TREATMENT FOR CHILDREN & YOUTH,From Distancing to Connecting: Residential Care Engagement with External Stakeholders Amidst COVID-19. An Italian Investigation,RESID TREAT CHILD YO,Resid. Treat. Child. Youth,RES TRE CHI,RESID TREAT CHILD YOUTH,1,publisher,"ROUTLEDGE JOURNALS, TAYLOR & FRANCIS LTD",1,"ROUTLEDGE JOURNALS, TAYLOR & FRANCIS LTD"
7349,WOS:001219556300001,WOS,WOS.SSCI,Article,Early Access,NA,"Article,Early Access",English,58,NA,NA,NA,NA,NA,NA,NA,"youth psychotherapy outcomes,youth self-efficacy,motivation,therapeutic alliance,social support,community care","COMMUNITY MENTAL-HEALTH,THERAPEUTIC ALLIANCE,ADOLESCENT,CHILD,INTERVENTIONS,METAANALYSIS,DEPRESSION,BEHAVIOR,FAMILY",Journal,13,: - MAY 11 2024,NA,NA,"Psychology, Clinical",NA,Psychology,Social Sciences,NA,"ObjectiveWe examined how youth self-efficacy, motivation for treatment, social support, and therapeutic alliance relate to psychotherapy outcomes of patients receiving services at outpatient community clinics. We hypothesized that (1) these variables would increase throughout the course of therapy, (2) baseline scores would predict initial ratings of distress, (3) baseline scores would predict the rate of change in symptoms throughout treatment, and (4) changes in these variables would be associated with symptom change over the course of treatment.MethodParticipants included 150 adolescents at community outpatient treatment centers. Data was collected prior to beginning treatment, and every three weeks afterward until termination. We used hierarchical linear modeling (HLM) to address our hypotheses.ResultsWe found that (1) youth ratings of self-efficacy, social support, and motivation increased throughout treatment, (2) initial self-efficacy and social support were associated with initial levels of distress, (3) ratings of youth self-efficacy at intake predicted its rate of change over therapy, and (4) changes in all variables during therapy were related to lower distress at termination.DiscussionResults suggest that these variables may affect the trajectory and course of treatment in community-based treatment settings. These results may have implications for treatment planning to maximize treatment effectiveness.",NA,NA,2024,2024-05-11,MAY 11,Journal,N,1050-3307,1468-4381,10.1080/10503307.2024.2349996,NA,MEDLINE:38735039,NA,NA,NA,PSYCHOTHERAPY RESEARCH,"Self-efficacy, motivation, social support, and alliance as predictors of youth psychotherapy outcomes in usual care",PSYCHOTHER RES,Psychother. Res.,PSYCHOTH RE,PSYCHOTHER RES,1,publisher,"ROUTLEDGE JOURNALS, TAYLOR & FRANCIS LTD",1,"ROUTLEDGE JOURNALS, TAYLOR & FRANCIS LTD"
5174,WOS:001281753100001,WOS,WOS.SSCI,Article,NA,NA,Article,English,110,NA,1,0,0,0,1,0,"Acceptance and commitment therapy,Randomized controlled trials,History of ACT,Lower- and middle-income countries,Process-based therapy","MINDFULNESS-BASED THERAPY,EXPERIENTIAL AVOIDANCE,COGNITIVE DEFUSION,3RD WAVE,STRESS,IMPACT,DEPRESSION,MANAGEMENT,SYMPTOMS,EFFICACY",Journal,22,33: - JUL 2024,NA,NA,"Psychology, Clinical",NA,Psychology,Social Sciences,NA,"Contextual Behavioral Science (CBS) and Acceptance and Commitment Therapy or Training (""ACT"" in either case) are arguably entering their 5th decade of development. This paper describes features of their early history and divides development into three phases, plus a fourth that is just beginning. In the context of that review, it examines what can be learned by a content analysis of the first similar to 1000 randomized controlled trials on ACT-based interventions, from 1986 through 2022. The expansive vision of CBS and the early ACT research base defined their breadth as far wider than psychological intervention targeting traditional psychiatric syndromes, emphasizing instead the principles, processes, and components needed for a more generally applicable approach. After an era of scientific establishment, ACT research has expanded globally and topically. Many RCTs now take place in lower- and middle-income countries with cultural and policy environments that give rise to unique research priorities. Finally, based on the ACBS Task Force Report and new research findings, we suggest that ACT research may be entering a new era of personalized and process-based intervention based on new ""idionomic"" forms of functional analysis.",JUL 2024,33,2024,2024-07-24,JUL,Journal,N,2212-1447,2212-1455,10.1016/j.jcbs.2024.100809,NA,NA,NA,NA,NA,JOURNAL OF CONTEXTUAL BEHAVIORAL SCIENCE,"Acceptance and commitment therapy: What the history of ACT and the first 1,000 randomized controlled trials reveal",J CONTEXT BEHAV SCI,J. Contextual Behav. Sci.,J CON BE SC,J CONTEXTUAL BEHAV SCI,1,publisher,ELSEVIER,1,ELSEVIER
6995,WOS:001229301900001,WOS,WOS.SSCI,Article,Early Access,NA,"Article,Early Access",English,106,NA,2,0,0,0,2,0,"Ramadan,Religion,Fasting,Nutrition","QUALITY-OF-LIFE,COGNITIVE FUNCTIONS,SPIRITUALITY,RELIGION,LIPIDS,SCALE,DIET,LIPOPROTEINS,RESTRICTION,PERFORMANCE",Journal,16,: - MAY 22 2024,NA,NA,"Psychology, Clinical",NA,Psychology,Social Sciences,NA,"Background Ramadan fasting has seen increased attention in research, often with inconsistent findings. This study aims to investigate whether dietary and lifestyle modifications during Ramadan can improve well-being and health in healthy adult Muslims. Method A randomised controlled trial with two parallel groups was conducted in an outpatient clinic of a university hospital in Essen, Germany, in 2016. Healthy adult Muslims (n = 114) aged 18-60 years were randomised to a modified fasting group; i.e., they received educational material prompting dietary and lifestyle modifications pre-Ramadan, and a control group who undertook Ramadan fasting as usual. Primary outcome was quality of life (WHO-5 Well-Being Index). Secondary outcomes included sleep quality, spirituality, and mindfulness (all self-report), body weight, body mass index, body fat, waist circumference, hip circumference, blood pressure, and heart rate, as well as blood serum biomarkers. Safety was examined via adverse events. Results The modified fasting group reported significantly higher quality of life (WHO-5) compared to the control after Ramadan (MD 5.9; 95% CI, 0.02-11.8; p < 0.05). Group differences in favour of the modified fasting were also found for satisfaction with health (MD 5.9, 95% CI 0.19-11.67), ease of life (MD 4.1, 95% CI 0.38-7.80) and mindfulness (MD 7.6, 95% CI 2.68-12.52), reductions in weight (MD, - 0.9 kg; 95% CI - 1.39 to - 0.42), BMI (MD - 0.3 kg/m(2), 95% CI - 0.50 to - 0.15), hip circumference (MD - 0.3 kg/m(2), 95% CI - 0.50 to - 0.15), and diastolic blood pressure (MD - 2.8 mmHg, 95% CI - 5.15 to - 0.43). About 60% of participants reported adverse events, mostly headaches/migraines, dizziness/fatigue, common cold, and gastrointestinal symptoms, with no group differences. One serious non-related adverse event each occurred in both groups. Conclusion Pre-Ramadan dietary and lifestyle advice can lead to short-term improvements in mental and physical well-being of adult Muslims observing Ramadan. As such, this study demonstrates the potential benefits of culturally appropriate health interventions in a religious context.",NA,NA,2024,2024-05-22,MAY 22,Journal,N,1070-5503,1532-7558,10.1007/s12529-024-10296-0,NA,MEDLINE:38777939,NA,NA,NA,INTERNATIONAL JOURNAL OF BEHAVIORAL MEDICINE,Effects of Modified Ramadan Fasting on Mental Well-Being and Biomarkers in Healthy Adult Muslims - A Randomised Controlled Trial,INT J BEHAV MED,Int. J. Behav. Med.,INT J BEH M,INT J BEHAVIORAL MEDICINE,1,publisher,SPRINGER,1,SPRINGER
10528,WOS:001142429300001,WOS,WOS.SCI,Article,NA,NA,Article,English,48,NA,1,1,0,0,0,0,"aging,metamemory,metacognition,memory,learning","MILD COGNITIVE IMPAIRMENT,EPISODIC MEMORY,OLDER-ADULTS,CORTEX,INVARIANCE,DISEASE",Journal,102,30 (5): 479-488 JUN 2024,Life Sciences & Biomedicine,NA,Clinical Neurology,Neurosciences,"Neurosciences & Neurology,Psychiatry,Psychology",Science & Technology,Social Sciences,"Objective:Although the effect of aging on episodic memory is relatively well studied, little is known about how aging influences metamemory. In addition, while executive function (EF) is known to mediate the age-related decline in episodic memory, the role of metamemory in aging-related memory differences beyond EF remains unknown. This study aimed to elucidate the effect of aging on metamemory and to clarify the role of metamemory in the age-related decline in memory.Method:One hundred and four adults aged 18-79 years (50 M, 54 F) performed several EF tasks, as well as a face-scene paired-associate learning task that required them to make judgments of learning, feeling-of-knowing judgments, and retrospective confidence judgments.Results:Aging was significantly associated with poor metamemory accuracy and increased confidence across metamemory judgment types, even after controlling for EF and memory performance. A parallel mediation analysis indicated that both confidence of learning and EF performance had significant partial mediation effects on the relationship between aging and memory, albeit in different ways. Specifically, poor EF explained the age-related decline in memory, whereas increased confidence of learning served to compensate for this memory decline.Conclusions:Aging is associated with general changes (i.e., poor inferences from cues) rather than specific changes (i.e., declined activation or utilization of certain cues) in metamemory monitoring. Also, changes in confidence of learning and in EF ability contribute to the preservation and decline of memory during aging, respectively. Therefore, boosting confidence during encoding and enhancing EF skills might be complementary memory intervention strategies for older adults.",JUN 2024,30,2024,2024-01-15,JUN,Journal,N,1355-6177,1469-7661,10.1017/S1355617723011451,NA,MEDLINE:38221867,NA,NA,NA,JOURNAL OF THE INTERNATIONAL NEUROPSYCHOLOGICAL SOCIETY,Metamemory and executive function mediate the age-related decline in memory,J INT NEUROPSYCH SOC,J. Int. Neuropsychol. Soc.,J INT NEURO,J INT NEUROPSYCHOL SOC,1,publisher,CAMBRIDGE UNIV PRESS,1,CAMBRIDGE UNIV PRESS
4816,WOS:001292695900001,WOS,"WOS.SCI,WOS.SSCI",Article,NA,NA,Article,English,67,NA,NA,NA,NA,NA,NA,NA,NA,"INTERLEUKIN-18,INFERTILITY,PREGNANCY,WOMEN,WELL,ENDOMETRIOSIS,METAANALYSIS,PREVALENCE,RECURRENT,INSIGHTS",Journal,25,2024: - AUG 5 2024,Life Sciences & Biomedicine,NA,"Psychology, Clinical",Psychiatry,"Psychology,Psychiatry",Social Sciences,Science & Technology,"This research has suggested a link between major depressive disorder (MDD) and infertility, with interleukin-18 (IL-18) being proposed as a potential mediator due to its connections to both conditions. A Mendelian randomization (MR) approach was utilized in this study, which drew on genetic data from 500,199 European participants studied for MDD, along with additional IL-18 and reproductive health data from the FinnGen consortium and GWAS datasets. Single nucleotide polymorphisms were employed as instrumental variables to examine the causal relationships between MDD, genetically predicted IL-18 levels, and infertility. In our study, bidirectional MR analysis revealed a significant inverse causal relationship between MDD and genetically predicted IL-18 levels, with a higher genetic predisposition to MDD, correlating with reduced IL-18 levels (beta: -0.40; 95% confidence interval (CI): -0.69 to -0.11; P = 7.09 x 10-3). Additionally, MDD is found to significantly increase the risk of female infertility. Notably, genetically predicted IL-18 levels demonstrated a protective effect against female infertility (odds ratio (OR): 0.92; 95% CI: 0.86-0.98; P = 1.17 x 10-2). Mediation analysis indicated that genetically predicted IL-18 levels partially mediated the impact of MDD on female infertility associated with cervical, vaginal, other or unspecified origin, accounting for up to 14.61% of this effect. No evidence of pleiotropy or heterogeneity was detected. The role of genetic predispositions to MDD in influencing genetically predicted IL-18 levels, and subsequently, female infertility, was highlighted by our study, offering insights into the complex interplay between mental health and reproductive biology. These findings contribute to a deeper understanding of the genetic and molecular pathways influencing these conditions, suggesting new directions for research and potential therapeutic interventions.",AUG 5 2024,2024,2024,2024-08-05,AUG 5,Journal,N,1091-4269,1520-6394,10.1155/2024/9234876,NA,MEDLINE:40226698,NA,NA,NA,DEPRESSION AND ANXIETY,Perspective Exploring Novel Associations of IL-18 Levels as a Mediator of the Causal Links between Major Depression and Reproductive Health,DEPRESS ANXIETY,Depress. Anxiety,DEPRESS ANX,DEPRESS ANXIETY,1,publisher,WILEY,1,WILEY
