49,WOS:001413861300008,WOS,WOS.ESCI,Article,NA,NA,Article,English,66,NA,NA,NA,NA,NA,NA,NA,"ACT,Clinical Psychology,Depression,Executive Functioning,Suicidal Behavior","DECISION-MAKING,SOCIAL SUPPORT,METAANALYSIS,DISORDER",Journal,203,12 (3): - 2024,NA,NA,"Psychology, Clinical",NA,Psychology,Social Sciences,NA,"Background: Suicidal behavior (SB) is a global public health issue, particularly due to its significant increase in recent years. Affective disorders, such as depressive disorder (DD), are strongly linked to suicidal ideation (SI), suicide attempts (SA), and completed suicides. Cognitive difficulties are among the hallmark features of DD, forming a part of its nosological definition,specifically, those related to executive functioning. The acceptance and commitment therapy (ACT) has been used as an intervention for different affective disorders, generating significant improvements in symptoms, but also, it strengthens psychological flexibility, attention, working memory and planning in people with various pathologies.To date, few studies in Colombia have investigated the effects of an ACT-based intervention on EF and SB risk in adults with DD. Methodology: Thirty-two adults diagnosed with depressive disorder were randomly assigned to two groups: Experimental Group (EG) and Active Control Group (ACG). The following assessments were administered: Sociodemographic Survey, Suicidality Scale (SS), Patient Health Questionnaire (PHQ9), and executive functioning subtests: Wechsler Adult Intelligence Scale (working memory index), and Neuropsi: attention and memory. For the statistical analyses, descriptive statistics were calculated to summarize the sociodemographic variables and the normalized instrument scores for both groups. The Shapiro-Wilk test was used to assess the normality of the distributions, an important step given the small sample size (<50), which influenced the choice of non-parametric methods. Group comparisons were made using the Mann-Whitney U test for independent samples and the Bayesian Wilcoxon signed-rank test. Results: The variables ""Successive Series"" and ""Working Memory Index"" showed statistically significant differences between the two groups, with a Bayesian factor providing anecdotal evidence in favor of the alternative hypothesis. For the remaining variables, Bayesian factors suggested evidence in favor of the null hypothesis, indicating insufficient evidence to confirm differences between the groups in these specific skills. Conclusions: The results of this study indicate that the effects of an ACT-based intervention are evident in visuospatial working memory, as well as in tasks involving verbal fluency, inhibitory control, and language in the experimental group (EG). For the other cognitive variables, their p-values do not show significant differences. About the clinical variables, while it is not possible to attribute the reduction in suicidality scale scores solely to the effect of the ACT intervention, it can be concluded that both ACT and the intervention in the active control group (ACG) show promising results in reducing the suicide risk in this population.",2024,12,2024,2024-01-01,NA,Journal,N,2282-1619,NA,10.13129/2282-1619/mjcp-4504,NA,NA,NA,NA,NA,MEDITERRANEAN JOURNAL OF CLINICAL PSYCHOLOGY,The Effect of an Acceptance and Commitment Therapy-Based Intervention on Executive Functioning and Risk of Suicidal Behavior in Adults with Depression,MEDITERR J CLIN PSYC,Mediterr. J. Clin. Psychol.,MED J CLI P,MEDITERR J CLIN PSYCHOL,1,publisher,UNIV STUDI MESSINA,1,UNIV STUDI MESSINA
11403,WOS:001101093100001,WOS,WOS.SSCI,Article,NA,NA,Article,English,107,NA,NA,NA,NA,NA,NA,NA,"culture,fathering,marital satisfaction,parenting styles,spousal support","CHILD-RELATIONSHIP QUALITY,PARENTING STYLES,RELATIONSHIP SATISFACTION,INTERPARENTAL CONFLICT,BEHAVIORAL-INHIBITION,PATERNAL INVOLVEMENT,DEPRESSIVE SYMPTOMS,SPOUSAL SUPPORT,TEMPERAMENT,TRANSITION",Journal,583,63 (3): 1551-1573 SEP 2024,NA,NA,"Psychology, Clinical",Family Studies,"Psychology,Family Studies",Social Sciences,NA,"This study had two main objectives. The first goal was to examine fathers' parenting styles in a society with traditional patriarchal values. The second goal was to understand the extent to which marital relationship variables (i.e., marital satisfaction and spousal support) are related with the identified fathering profiles. The theoretical and empirical underpinnings of the ""parenting styles"" literature that form the foundation of the research on parent-child dynamics are still mainly based on data collected only from mothers. This weakness of the literature on fathering typologies is further accompanied by the scarcity of data on fathers' parenting practices from non-Western contexts. To achieve the study aims, a latent profile analysis based on warmth and control dimensions of parenting was performed using a nationally representative sample of 1070 urban fathers in Turkey. Using scores on six parenting behavior variables (i.e., warmth, punishment, inductive reasoning, positive parenting, discipline and teaching responsibilities, time and talking together), results revealed four fathering profiles: ""authoritative"" (30%), ""average"" (45%), ""uninvolved"" (16%), and ""disciplining-distant"" (8%). Furthermore, the results showed that the fathering profiles significantly differed from each other on the marital satisfaction and spousal support scores. Results highlight the importance of investigating fathering behaviors and their predictors in different cultures.",SEP 2024,63,2024,2023-11-08,SEP,Journal,N,0014-7370,1545-5300,10.1111/famp.12948,NA,MEDLINE:37936511,NA,NA,NA,FAMILY PROCESS,Fathering styles in a traditional culture and its association with marital relationship: A latent profile analysis with a nationally representative sample,FAM PROCESS,Fam. Process,FAM PROCESS,FAM PROCESS,1,publisher,WILEY,1,WILEY
156,WOS:001335057700001,WOS,WOS.SSCI,Article,NA,NA,Article,English,40,NA,NA,NA,NA,NA,NA,NA,"anxiety disorders,clinical child intervention,single session intervention,booster session","COGNITIVE-BEHAVIORAL THERAPY,ANXIOUS YOUTH,LONG-TERM,CHILD,DISORDERS,SCREEN,PARENT,ISSUES",Journal,9,31 (4): 539-547 NOV 2024,NA,NA,"Psychology, Clinical",NA,Psychology,Social Sciences,NA,"There is a subset of youth who, despite responding well to CBT, experience a return of anxiety in the years after treatment ends. Although empirical research and clinical recommendations have described approaches to prevent a return of anxiety following CBT, to our knowledge, no empirical or clinical articles have evaluated approaches to help youth who have experienced such a return. In this article, we take an initial step toward providing clinical guidance on addressing recurrence in youth with anxiety disorders by describing the development of an approach, a booster session delivered remotely using telehealth, and by presenting promising preliminary data in a case series among three youths who experienced a return of anxiety following CBT. Participants were N = 3 youths ages 10 to 15 years (M = 12 years; 33% male, 33% female, 33% nonbinary) who previously completed a full CBT protocol for anxiety disorders as part of outpatient clinical services in an urban area of the southeastern United States. Parent- and youth-report on youth anxiety severity were assessed pretreatment and posttreatment. Clinical response to the booster among these three families was mixed and varied by informant source, with an overall positive response according to parent ratings and a smaller response according to youth ratings. This case series represents an important first step toward addressing the return of anxiety in youth following CBT, and findings provide the impetus for further development and evaluation work of single session boosters. Limitations and implications of the findings are discussed.",NOV 2024,31,2024,2024-10-04,NOV,Journal,N,1077-7229,1878-187X,10.1016/j.cbpra.2023.04.001,NA,NA,NA,NA,NA,COGNITIVE AND BEHAVIORAL PRACTICE,Single-Session Telehealth Booster for Youth Experiencing a Return of Anxiety After CBT: A Case Series,COGN BEHAV PRACT,Cogn. Behav. Pract.,COG BEHAV P,COGN BEHAV PRACT,1,publisher,ELSEVIER SCIENCE INC,1,ELSEVIER SCIENCE INC
10514,WOS:001147570700001,WOS,WOS.SSCI,Article,NA,NA,Article,English,23,NA,NA,NA,NA,NA,NA,NA,"adherence,alcohol,drugs,health psychology,TB",TUBERCULOSIS,Journal,133,29 (7): - JUN 2024,NA,NA,"Psychology, Clinical",NA,Psychology,Social Sciences,NA,"This cross-sectional study aimed to explore the use of alcohol and drugs and the potential impact on adherence to medication for tuberculosis. Adult patients admitted to specialised tuberculosis hospitals in South Africa were assessed for drug use, alcohol use and adherence to tuberculosis medication. A total of 175 patients participated in the study; 32% reported harmful alcohol use, and 44% reported problematic use of drugs. Participants who used drugs were four times as likely (OR = 4.11, 95% CI (1.89, 8.91)) and those using alcohol were twice as likely (OR = 2.06, 95% CI (1.02, 5.08)) to be nonadherent to medication for tuberculosis. Prevalence of harmful/hazardous use of alcohol and other drugs was high and significantly correlated with poorer medication adherence. Routine screening for and treatment of substance use in patients on treatment for tuberculosis and ongoing monitoring of adherence to medication is recommended.",JUN 2024,29,2024,2024-01-21,JUN,Journal,N,1359-1053,1461-7277,10.1177/13591053231224124,NA,MEDLINE:38247264,NA,NA,NA,JOURNAL OF HEALTH PSYCHOLOGY,Prevalence of alcohol and drug use and their impact on adherence among hospitalised TB patients in South Africa,J HEALTH PSYCHOL,J. Health Psychol.,J HEAL PSYC,J HEALTH PSYCHOL,1,publisher,SAGE PUBLICATIONS LTD,1,SAGE PUBLICATIONS LTD
9783,WOS:001162224000002,WOS,WOS.SSCI,Article,NA,NA,Article,English,81,NA,2,2,1,0,1,1,"narcissism,assessment,within-person,variability","PATHOLOGICAL NARCISSISM,SHORT-FORM,PERSONALITY,INVENTORY,GRANDIOSE,SAMPLE,VALIDATION,INVARIANCE,DISORDER,VERSION",Journal,86,36 (2): 147-161 FEB 2024,NA,NA,"Psychology, Clinical",NA,Psychology,Social Sciences,NA,"Although interindividual differences in narcissism are well studied, little is known about assessing narcissism at the within-person level. To fill this research gap, we investigated whether the narcissism construct is represented in the same way at the between- and within-person levels. We analyzed four established narcissism measures across multiple studies. In each of the studies, participants completed narcissism measures in ecological momentary assessment or daily diary studies. Equivalent construct representation across between- and within-person narcissism (i.e., cross-level measurement invariance) was found. State narcissism measures showed convergent validities for the trait narcissism scales. Moreover, we also found that antagonistic narcissism was most strongly related to within-person variability in narcissism. Our investigation sheds new light on the structure and assessment of narcissism on the within-person level by providing a comprehensive examination of its measurement.",FEB 2024,36,2024,2024-02-01,FEB,Journal,N,1040-3590,1939-134X,10.1037/pas0001295,NA,MEDLINE:38236268,NA,NA,NA,PSYCHOLOGICAL ASSESSMENT,The Peaks and Valleys of Narcissism: The Factor Structure of Narcissistic States and Their Relations to Trait Measures,PSYCHOL ASSESSMENT,Psychol. Assess.,PSYC ASSESS,PSYCHOL ASSESSMENT,1,publisher,AMER PSYCHOLOGICAL ASSOC,1,AMER PSYCHOLOGICAL ASSOC
11490,WOS:001112744500001,WOS,"WOS.SCI,WOS.SSCI",Article,NA,NA,Article,English,82,NA,2,2,0,0,1,1,"dual-systems models,endophenotype,genetic factors,impulsive personality traits,neurogenetic,neuroimaging","SENSATION-SEEKING,ALCOHOL-USE,UPPS-P,ADOLESCENCE,BEHAVIOR,EMOTION,VULNERABILITY,TEMPERAMENT,THICKNESS,RESPONSES",Journal,426,54 (8): 1533-1543 JUN 2024,Life Sciences & Biomedicine,NA,"Psychology, Clinical",Psychiatry,"Psychology,Psychiatry",Social Sciences,Science & Technology,"BackgroundDual-systems models, positing an interaction between two distinct and competing systems (i.e. top-down self-control, and bottom-up reward- or emotion-based drive), provide a parsimonious framework for investigating the interplay between cortical and subcortical brain regions relevant to impulsive personality traits (IPTs) and their associations with psychopathology. Despite recent developments in multivariate analysis of genome-wide association studies (GWAS), molecular genetic investigations of these models have not been conducted.MethodsUsing IPT GWAS, we conducted confirmatory genomic structural equation models (GenomicSEM) to empirically evaluate dual-systems models of the genetic architecture of IPTs. Genetic correlations between dual-systems factors and relevant cortical and subcortical neuroimaging phenotypes (regional/structural volume, cortical surface area, cortical thickness) were estimated and compared.ResultsGenomicSEM dual-systems models underscored important sources of shared and unique genetic variance between top-down and bottom-up constructs. Specifically, a dual-systems genomic model consisting of sensation seeking and lack of self-control factors demonstrated distinct but related sources of genetic influences (rg = 0.60). Genetic correlation analyses provided evidence of differential associations between dual-systems factors and cortical neuroimaging phenotypes (e.g. lack of self-control negatively associated with cortical thickness, sensation seeking positively associated with cortical surface area). No significant associations were observed with subcortical phenotypes.ConclusionsDual-systems models of the genetic architecture of IPTs tested were consistent with study hypotheses, but associations with relevant neuroimaging phenotypes were mixed (e.g. no associations with subcortical volumes). Findings demonstrate the utility of dual-systems models for studying IPT genetic influences, but also highlight potential limitations as a framework for interpreting IPTs as endophenotypes for psychopathology.",JUN 2024,54,2024,2023-11-29,JUN,Journal,N,0033-2917,1469-8978,10.1017/S0033291723003367,NA,MEDLINE:38016992,NA,NA,NA,PSYCHOLOGICAL MEDICINE,Dual-systems models of the genetic architecture of impulsive personality traits: neurogenetic evidence of distinct but related factors,PSYCHOL MED,Psychol. Med.,PSYCHOL MED,PSYCHOL MED,1,publisher,CAMBRIDGE UNIV PRESS,1,CAMBRIDGE UNIV PRESS
2218,WOS:001343466400007,WOS,WOS.ESCI,Article,NA,NA,Article,English,58,NA,NA,NA,NA,NA,NA,NA,"forgiveness,religion,spirituality,positive psychology,humility","POSITIVE PSYCHOLOGY,CULTURAL HUMILITY,FORGIVENESS",Journal,93,11 (2): 122-132 JUN 2024,NA,NA,"Psychology, Clinical",NA,Psychology,Social Sciences,NA,"This article offers reflections on the experience and influence of working with Everett L. Worthington Jr. as a doctoral student and postgraduate collaborator. Worthington's contributions as an integrationist are highlighted with attention to (a) psychology, religion, and spirituality; (b) relational dynamics; (c) forgiveness as virtue; (d) humility as virtue; and (e) intervention research. Attention is given to the psychology of virtue as making necessary movement toward sociocultural contextualization. Worthington's historical contributions are briefly and personally reviewed as helping reconfigure the place of religion, spirituality, and virtue within positive psychology and mental health fields.",JUN 2024,11,2024,2024-06-01,JUN,Journal,N,2326-4500,2326-4519,10.1037/scp0000355,NA,NA,NA,NA,NA,SPIRITUALITY IN CLINICAL PRACTICE,"The Generative Virtues of Integrating Psychology, Religion, and Spirituality: A Tribute to Everett L. Worthington Jr.",SPIRITUAL CLIN PRACT,Spiritual. Clin. Pract.,SPIR CLI PR,SPIRITUAL CLIN PRACT,1,publisher,EDUCATIONAL PUBLISHING FOUNDATION-AMERICAN PSYCHOLOGICAL ASSOC,1,EDUCATIONAL PUBLISHING FOUNDATION-AMERICAN PSYCHOLOGICAL ASSOC
4388,WOS:001300950000001,WOS,WOS.SSCI,Article,NA,NA,Article,English,48,NA,4,1,0,0,3,1,"assessment,attention-deficit/hyperactivity disorder,diagnostic interview,sluggish cognitive tempo","AFFECTIVE-DISORDERS,FUTURE-DIRECTIONS,CHILDREN,TEMPO,RELIABILITY,SCHEDULE,VALIDITY,SCHIZOPHRENIA,ADHD,IV",Journal,70,36 (10): 618-630 OCT 2024,NA,NA,"Psychology, Clinical",NA,Psychology,Social Sciences,NA,"Cognitive disengagement syndrome (CDS), formerly termed sluggish cognitive tempo, is a set of symptoms characterized by excessive daydreaming, mental confusion, and slowed behavior/thinking. CDS is distinct from symptoms of attention-deficit/hyperactivity disorder (ADHD) and other psychopathologies and uniquely associated with functional impairment. However, despite significant progress in developing and evaluating rating scale measures of CDS, no clinical interview of CDS exists with established psychometric properties that can facilitate a multimethod approach assessing CDS. Accordingly, the present study evaluated the psychometric properties of the semistructured Cognitive Disengagement Syndrome-Clinical Interview (CDS-CI). The CDS-CI and the ADHD inattention (ADHD-IN) and hyperactive-impulsivity (ADHD-HI) modules from the Kiddie Schedule of Affective Disorders and Schizophrenia for School-Age Children (K-SADS) were administered to a sample of early adolescents (N = 341, ages 10-12 years) and their caregivers. Adolescents and caregivers also completed rating scale measures of CDS and ADHD symptoms. The CDS-CI demonstrated high internal consistency and interrater reliability. CDS-CI scores showed excellent same-source discriminant validity from K-SADS, ADHD-IN, and ADHD-HI scores and encouraging convergent and discriminant validity with rating scale measures, especially for caregivers. Above and beyond K-SADS, ADHD-IN, and ADHD-HI scores, higher parent and adolescent CDS-CI scores were both significantly associated with greater functional impairment. A threshold of >= 6 out of 15 symptoms was selected as an initial threshold for determining clinically elevated CDS using the CDS-CI. Findings provide psychometric support for the CDS-CI as a tool in the multimethod assessment of CDS.",OCT 2024,36,2024,2024-07-08,OCT,Journal,N,1040-3590,1939-134X,10.1037/pas0001330,NA,MEDLINE:38976451,NA,NA,NA,PSYCHOLOGICAL ASSESSMENT,Cognitive Disengagement Syndrome-Clinical Interview (CDS-CI): Psychometric Support for Caregiver and Youth Versions,PSYCHOL ASSESSMENT,Psychol. Assess.,PSYC ASSESS,PSYCHOL ASSESSMENT,1,publisher,AMER PSYCHOLOGICAL ASSOC,1,AMER PSYCHOLOGICAL ASSOC
4244,WOS:001300933500001,WOS,WOS.SSCI,Article,NA,NA,Article,English,71,NA,NA,NA,NA,NA,NA,NA,"sexual empowerment,Hispanic women,college","ADOLESCENT COMMUNICATION,QUALITATIVE RESEARCH,SKIN COLOR,ASSERTIVENESS,BEHAVIORS,STUDENTS,GENDER,HEALTH,VICTIMIZATION,MACHISMO",Journal,101,12 (4): 394-411 NOV 2024,NA,NA,"Psychology, Clinical","Psychology, Developmental",Psychology,Social Sciences,NA,"Identifying Hispanic college women's perceptions of their ability to initiate sexual intimacy is critical given findings showing it can be a protective factor against sexual assault and other negative outcomes. Although research has shown sexually assertive behaviors are increasingly becoming normalized among women across college contexts, research specifically focused on Hispanic women's perceptions of these behaviors remains limited. Guided by sexual scripting theory, this study examines 36 Hispanic college women's subjective perceptions of women's initiation of sexual intercourse with men. Two key themes were identified through thematic analysis: (a) perceptions of women's sexual assertiveness and (b) appropriate strategies for initiating sexual intimacy. Although traditional gender beliefs did influence their beliefs, being sexually assertive was viewed as an acceptable strategy by most participants. However, fears of violating norms communicated via familial, peer, and cultural messaging influenced women's ability to initiate intimacy with men. These findings highlight the importance of developing interventions targeting gender and contextual beliefs to increase healthy sexual initiation skills and reduce risk for unwanted sexual experiences among Hispanic women on campuses today.",NOV 2024,12,2024,2024-05-23,NOV,Journal,N,2578-8086,2578-8094,10.1037/lat0000261,NA,NA,NA,NA,NA,JOURNAL OF LATINX PSYCHOLOGY,"""It's More Like the Girl Doesn't Really Have to Do Anything"": Hispanic College Women's Sexual Initiation Strategy Perceptions",J LATINX PSYCHOL,J. Latinx Psychol.,J LATINX PS,J LATINX PSYCHOL,1,publisher,EDUCATIONAL PUBLISHING FOUNDATION-AMERICAN PSYCHOLOGICAL ASSOC,1,EDUCATIONAL PUBLISHING FOUNDATION-AMERICAN PSYCHOLOGICAL ASSOC
2767,WOS:001327852200003,WOS,WOS.SSCI,Article,NA,NA,Article,English,83,NA,2,1,0,0,0,1,"postpartum period,pregnancy,posttraumatic stress disorder,obsessive-compulsive disorder,network analysis","TRAUMATIC LIFE EVENTS,POSTPARTUM WOMEN,PREVALENCE,DEPRESSION,VALIDATION,PREGNANCY,PTSD,COMORBIDITY,SPECTRUM,RISK",Journal,76,133 (6): 445-455 AUG 2024,Life Sciences & Biomedicine,NA,"Psychology, Clinical",Psychiatry,"Psychology,Psychiatry",Social Sciences,Science & Technology,"The perinatal period is marked by a higher risk of experiencing depressive, anxiety, and/or trauma-related symptoms, a phenomenon that affects millions of individuals each year. Obsessive-compulsive disorder (OCD) and posttraumatic stress disorder (PTSD) symptoms commonly co-occur but have rarely been examined together beyond prevalence estimates in the perinatal period. Our study aimed to explore patterns of associations among OCD and PTSD symptoms to elucidate within- and between-person effects and how these effects may change over time. Participants (N = 270) were recruited during pregnancy from an academic medical center affiliated with a midwestern university. PTSD, OCD, and depressive symptoms were assessed at pregnancy, 4, 8, and 12 weeks postpartum. A panel graphical vector autoregression model was used to estimate networks. The temporal network provided information regarding directed predictive effects between symptoms, and hyperarousal, neutralizing, and ordering were the most stable and predictive symptoms across time. The contemporaneous network, which yields undirected partial correlations between symptoms at a given moment, indicated that there were positive associations between intrusions and avoidance, hyperarousal and negative alterations in cognitions and mood, as well as between hyperarousal and dysphoria. This study identified hyperarousal and neutralizing as the PTSD and OCD symptoms with the strongest stability, predictive power, and association with other symptoms. Clinically, this indicates that screening for hyperarousal and neutralizing symptoms may identify individuals who could maximally benefit from treatment in the perinatal period. This study elucidates the posttraumatic stress disorder and obsessive-compulsive disorder symptoms most important to assess during pregnancy and the postpartum period. Network analysis determined that negative alterations in cognitions and mood, obsessing, checking, and avoidance symptoms as the symptoms with the highest relative importance in the between-person network, while hyperarousal, neutralizing, and ordering symptoms were the most stable and predictive symptoms across time. Posttraumatic stress disorder and obsessive-compulsive disorder symptoms are not routinely assessed by health care professionals, yet results suggest identified symptoms warrant closer attention in clinical and obstetric settings.",AUG 2024,133,2024,2024-08-01,AUG,Journal,N,2769-7541,2769-755X,10.1037/abn0000916,NA,MEDLINE:38815083,NA,NA,NA,JOURNAL OF PSYCHOPATHOLOGY AND CLINICAL SCIENCE,A Panel Network Analysis of Posttraumatic Stress Disorder and Obsessive-Compulsive Disorder Symptoms Across the Perinatal Period,J PSYCHOPATHOL CLIN,J. Psychopathology Clin. Sci.,J PSYCH C S,J PSYCHOPATHOLOGY CLIN SCI,1,publisher,AMER PSYCHOLOGICAL ASSOC,1,AMER PSYCHOLOGICAL ASSOC
